"India A vs England Lions: Rahane to lead, Pant named in squad for final 2 matches",2019-01-20 08:18:12.867760
How India cricketers spent their last day in Australia after historic triumph,2019-01-20 08:18:12.909649
1st ODI Highlights: Pakistan beat South Africa by 5 wickets,2019-01-20 08:18:12.909649
"Pujara hundreds, Pant banter and Dhoni 2.0: Recapping India's historic Australia tour",2019-01-20 08:18:12.910646
Cricket a special part of my life but not the most important thing: Virat Kohli,2019-01-20 08:18:12.910646
Wasim Akram in awe of Jasprit Bumrah's ability to bowl yorkers,2019-01-20 08:18:12.910646
BBL 2018-19: Marcus Stoinis laughs off Kane Richardson's imitation of The Hulk celebration,2019-01-20 08:18:12.910646
"India vs Australia: MS Dhoni is back with a vengeance, says Allan Border",2019-01-20 08:18:12.911643
"3 legends, 1 photo. Australian Open trolled over Federer, Kohli, Anushka photo caption",2019-01-20 08:18:12.911643
Hardik Pandya-KL Rahul controversy: BCCI acting president refuses to convene SGM,2019-01-20 08:18:12.911643
Cheteshwar Pujara stars in record chase as Saurashtra reach Ranji Trophy semi-final ,2019-01-20 08:18:12.912640
Ball le lo or they will say I am retiring: MS Dhoni jokes with Bangar after Melbourne win,2019-01-20 08:18:12.912640
READ THIS,2019-01-20 08:18:12.912640
Watch Right Now,2019-01-20 08:18:12.913637
Top Takes,2019-01-20 08:18:12.913637
